{
  "task_id": "industry-patterns-admin-ui-quality-stage13-20260506",
  "overall_verdict": "PASS",
  "criteria": [
    {
      "id": "AC1",
      "status": "PASS",
      "reason": "Safety/status panel added to the admin pattern UI."
    },
    {
      "id": "AC2",
      "status": "PASS",
      "reason": "Destructive actions require explicit UI and backend confirmation."
    },
    {
      "id": "AC3",
      "status": "PASS",
      "reason": "Rollback apply requires a token produced by rollback preview."
    },
    {
      "id": "AC4",
      "status": "PASS",
      "reason": "Admin pattern actions are logged and recent events are displayed."
    },
    {
      "id": "AC5",
      "status": "PASS",
      "reason": "No-auth production endpoint check returned 403."
    }
  ],
  "commands_run": [
    "cd frontend && ./node_modules/.bin/tsc -p tsconfig.app.json --noEmit",
    "python3 -m py_compile src/core/industry_pattern_recalibration.py src/api/admin_industry_patterns_api.py",
    "PYTHONPATH=src python3 -m pytest -q tests/test_industry_patterns.py",
    "cd frontend && npm run build:all",
    "bash scripts/deploy_backend_src.sh",
    "bash scripts/deploy_frontend_dist.sh"
  ],
  "artifacts_used": [
    ".agent/tasks/industry-patterns-admin-ui-quality-stage13-20260506/evidence.md"
  ]
}
