{
  "task_id": "supervised-outreach-integration-20260524",
  "overall_verdict": "PASS",
  "criteria": [
    {
      "id": "AC1",
      "status": "PASS",
      "reason": "Run input can use lead_ids and produce a hydrated lead_shortlist artifact."
    },
    {
      "id": "AC2",
      "status": "PASS",
      "reason": "Shortlist approval includes artifact payload and applies the existing outreach status transition."
    },
    {
      "id": "AC3",
      "status": "PASS",
      "reason": "Blueprint creates LocalOS message drafts from approved shortlist leads without provider writes."
    },
    {
      "id": "AC4",
      "status": "PASS",
      "reason": "Draft approval approves generated drafts and send capability receives those draft_ids."
    },
    {
      "id": "AC5",
      "status": "PASS",
      "reason": "Live smoke verified queue-only behavior with dispatcher disabled."
    },
    {
      "id": "AC6",
      "status": "PASS",
      "reason": "Targeted tests, lint, deploy, live smoke, and server health checks passed."
    }
  ],
  "commands_run": [
    "python3 -m py_compile src/services/agent_blueprint_runner.py scripts/smoke_agent_blueprint_outreach_api.py",
    "PYTHONPATH=src python3 -m pytest -q tests/test_agent_blueprint_layer.py tests/test_operator_paid_action_adapter.py tests/test_operator_review_reply_bulk.py",
    "scripts/lint_backend_baseline.sh",
    "git push origin main",
    "git push gitverse main",
    "git archive --format=tar HEAD src scripts/smoke_agent_blueprint_outreach_api.py scripts/lint_backend_baseline.sh docker-compose.yml | ssh ...",
    "cat scripts/smoke_agent_blueprint_outreach_api.py | ssh ... docker compose exec -T app ...",
    "ssh ... 'cd /opt/seo-app && docker compose ps && docker compose logs --since 10m app ...'"
  ],
  "artifacts_used": [
    ".agent/tasks/supervised-outreach-integration-20260524/raw/build.txt",
    ".agent/tasks/supervised-outreach-integration-20260524/raw/test-unit.txt",
    ".agent/tasks/supervised-outreach-integration-20260524/raw/test-integration.txt",
    ".agent/tasks/supervised-outreach-integration-20260524/raw/lint.txt"
  ]
}
