{
  "task_id": "finance-crm-contract-clients-stage14-15-20260512",
  "overall_verdict": "PASS",
  "criteria": [
    {
      "id": "AC1",
      "status": "PASS",
      "reason": "Anonymized CRM contract fixture exists."
    },
    {
      "id": "AC2",
      "status": "PASS",
      "reason": "Fixture is loaded and asserted by tests."
    },
    {
      "id": "AC3",
      "status": "PASS",
      "reason": "Appointments aggregate into staff KPI rows."
    },
    {
      "id": "AC4",
      "status": "PASS",
      "reason": "Appointments aggregate into service KPI rows."
    },
    {
      "id": "AC5",
      "status": "PASS",
      "reason": "Fixture is synthetic and preview masking remains covered."
    },
    {
      "id": "AC6",
      "status": "PASS",
      "reason": "Tests, compile, lint and build passed."
    }
  ],
  "commands_run": [
    "python3 -m pytest -q tests/test_finance_crm.py tests/test_finance_imports.py tests/test_finance_kpis.py",
    "python3 -m py_compile src/core/finance_crm.py src/core/finance_imports.py src/core/finance_kpis.py src/main.py",
    "cd frontend && npx eslint src/components/FinanceCrmPanel.tsx src/pages/dashboard/SettingsPage.tsx src/pages/dashboard/FinancePage.tsx",
    "cd frontend && npm run build"
  ],
  "artifacts_used": [
    ".agent/tasks/finance-crm-contract-clients-stage14-15-20260512/evidence.md",
    ".agent/tasks/finance-crm-contract-clients-stage14-15-20260512/evidence.json"
  ]
}
