{
  "task_id": "operator-sprint34-apify-worker-settlement-20260524",
  "overall_verdict": "PASS",
  "criteria": [
    {
      "id": "AC1",
      "status": "PASS",
      "reason": "Apify run usage fields are propagated from ProspectingService into worker debug payload."
    },
    {
      "id": "AC2",
      "status": "PASS",
      "reason": "Worker can locate a reserved map refresh reservation by metadata.parsequeue_id without schema changes."
    },
    {
      "id": "AC3",
      "status": "PASS",
      "reason": "Settlement is gated by Apify source, actual provider cost, queue identity, and matching reservation."
    },
    {
      "id": "AC4",
      "status": "PASS",
      "reason": "Missing cost/reservation skips settlement, and worker uses a savepoint around settlement."
    },
    {
      "id": "AC5",
      "status": "PASS",
      "reason": "No paid refresh enqueue, UI trigger, external write, or publication path was added."
    }
  ],
  "commands_run": [
    "python3 -m py_compile src/worker.py src/services/prospecting_service.py src/services/operator_apify_settlement.py",
    "python3 -m pytest -q tests/test_worker_apify_settlement.py tests/test_prospecting_service_apify_business_parse.py tests/test_operator_apify_settlement.py",
    "git diff --check"
  ],
  "artifacts_used": [
    ".agent/tasks/operator-sprint34-apify-worker-settlement-20260524/raw/build.txt",
    ".agent/tasks/operator-sprint34-apify-worker-settlement-20260524/raw/test-unit.txt",
    ".agent/tasks/operator-sprint34-apify-worker-settlement-20260524/raw/lint.txt"
  ]
}
