{
  "task_id": "beauty-service-problem-regeneration-stage6-20260505",
  "overall_verdict": "PASS",
  "criteria": [
    {
      "id": "AC1",
      "status": "PASS",
      "reason": "Start/status endpoints are implemented, authenticated, deployed, and route checks return 401 without auth."
    },
    {
      "id": "AC2",
      "status": "PASS",
      "reason": "Background job calls existing optimizer, persists drafts, tracks fixed/failed/manual/remaining, and logs events."
    },
    {
      "id": "AC3",
      "status": "PASS",
      "reason": "Attempt guard prevents repeated process-local regeneration and tests cover manual review selection."
    },
    {
      "id": "AC4",
      "status": "PASS",
      "reason": "UI button, limit copy, polling, and post-completion service refresh are implemented and frontend build passes."
    },
    {
      "id": "AC5",
      "status": "PASS",
      "reason": "Telegram menu callback now starts the backend job through a scoped session."
    },
    {
      "id": "AC6",
      "status": "PASS",
      "reason": "Existing ai learning event table is used; no migration was introduced."
    }
  ],
  "commands_run": [
    "python3 -m py_compile src/core/service_problem_regeneration.py src/api/services_api.py src/telegram_bot.py",
    "python3 -m pytest -q tests/test_service_keyword_scoring.py tests/test_service_problem_regeneration.py",
    "npm run build:all",
    "python3 -m pytest -q tests/test_beauty_service_optimization.py tests/test_service_keyword_scoring.py tests/test_service_problem_regeneration.py",
    "production: docker compose restart app worker",
    "production: systemctl restart openclaw-localos-telegram-bot.service",
    "production: unauthenticated POST/GET route checks returned 401",
    "production: docker compose logs and Telegram service status checked"
  ],
  "artifacts_used": [
    ".agent/tasks/beauty-service-problem-regeneration-stage6-20260505/evidence.json",
    "src/core/service_problem_regeneration.py",
    "src/api/services_api.py",
    "src/telegram_bot.py",
    "frontend/src/components/dashboard/useCardServiceController.ts",
    "frontend/src/components/dashboard/CardServicesControls.tsx",
    "tests/test_service_problem_regeneration.py"
  ]
}
