{
  "task_id": "p2-growth-route-dedupe-20260518",
  "overall_verdict": "PASS",
  "criteria": [
    {
      "id": "AC1",
      "status": "PASS",
      "reason": "Stale growth stage route handlers were removed from main.py."
    },
    {
      "id": "AC2",
      "status": "PASS",
      "reason": "Active route ownership remains on growth_api/admin_growth_api locally and live."
    },
    {
      "id": "AC3",
      "status": "PASS",
      "reason": "Lint baseline and focused tests now guard against stale main.py duplicate endpoints."
    },
    {
      "id": "AC4",
      "status": "PASS",
      "reason": "Focused local checks and live runtime smoke passed after deploy."
    }
  ],
  "commands_run": [
    "scripts/lint_backend_baseline.sh",
    "python3 -m py_compile src/main.py tests/test_growth_workflow_routes.py",
    "PYTHONPATH=src python3 -m pytest -q tests/test_growth_workflow_routes.py tests/test_reports_api_routes.py tests/test_security_runtime_config.py tests/test_query_adapter.py",
    "SMOKE_SINCE=5m SMOKE_LOG_LINES=120 scripts/smoke_runtime.sh server"
  ],
  "artifacts_used": [
    ".agent/tasks/p2-growth-route-dedupe-20260518/raw/build.txt",
    ".agent/tasks/p2-growth-route-dedupe-20260518/raw/test-unit.txt",
    ".agent/tasks/p2-growth-route-dedupe-20260518/raw/test-integration.txt",
    ".agent/tasks/p2-growth-route-dedupe-20260518/raw/lint.txt",
    ".agent/tasks/p2-growth-route-dedupe-20260518/raw/live-route-ownership.txt",
    ".agent/tasks/p2-growth-route-dedupe-20260518/raw/live-smoke-runtime.txt"
  ]
}
