{"task_id":"operator-sprint47-telegram-refresh-retry-20260524","overall_verdict":"PASS","criteria":[{"id":"AC1","status":"PASS","reason":"Telegram client intent recognizes refresh retry commands."},{"id":"AC2","status":"PASS","reason":"The owner bot calls the same request_refresh_retry backend service."},{"id":"AC3","status":"PASS","reason":"Billing/manual publication messaging remains explicit."},{"id":"AC4","status":"PASS","reason":"Targeted checks passed."}],"commands_run":["python3 -m py_compile src/services/telegram_dashboard.py src/services/telegram_response_router.py src/telegram_bot.py","PYTHONPATH=src:. python3 -m pytest -q tests/test_telegram_dashboard_copy.py tests/test_operator_refresh_retry.py","git diff --check"],"artifacts_used":[".agent/tasks/operator-sprint47-telegram-refresh-retry-20260524/raw/build.txt",".agent/tasks/operator-sprint47-telegram-refresh-retry-20260524/raw/test-unit.txt"]}
