{
  "task_id": "operator-sprint31-apify-actual-cost-settlement-20260523",
  "overall_verdict": "PASS",
  "criteria": [
    {
      "id": "AC1",
      "status": "PASS",
      "reason": "Settlement service and tests implemented."
    }
  ],
  "commands_run": [
    "python3 -m py_compile src/services/operator_apify_settlement.py",
    "python3 -m pytest -q tests/test_operator_apify_settlement.py tests/test_operator_credit_reservation.py tests/test_operator_map_refresh.py",
    "git diff --check"
  ],
  "artifacts_used": [
    "raw/build.txt",
    "raw/test-unit.txt"
  ]
}
