{"task_id":"operator-sprint45-parse-reliability-panel-20260524","overall_verdict":"PASS","criteria":[{"id":"AC1","status":"PASS","reason":"Reliability state exposes technical details for parse diagnosis."},{"id":"AC2","status":"PASS","reason":"Web Operator renders the details in the existing reliability panel."},{"id":"AC3","status":"PASS","reason":"Targeted tests, frontend build, and diff checks passed."}],"commands_run":["python3 -m py_compile src/services/operator_refresh_result.py src/api/operator_api.py","PYTHONPATH=src:. python3 -m pytest -q tests/test_operator_refresh_result.py tests/test_operator_refresh_retry.py","npm --prefix frontend run build","git diff --check"],"artifacts_used":[".agent/tasks/operator-sprint45-parse-reliability-panel-20260524/raw/build.txt",".agent/tasks/operator-sprint45-parse-reliability-panel-20260524/raw/test-unit.txt",".agent/tasks/operator-sprint45-parse-reliability-panel-20260524/raw/frontend-build.txt"]}
