{
  "task_id": "operator-sprint29-services-optimize-20260523",
  "overall_verdict": "PASS",
  "criteria": [
    {
      "id": "AC1",
      "status": "PASS",
      "reason": "paid suggestions save and charge; apply is separate."
    }
  ],
  "commands_run": [
    "python3 -m py_compile src/services/operator_services_optimization.py src/api/operator_api.py",
    "python3 -m pytest -q tests/test_operator_services_optimization.py tests/test_operator_social_post_generation.py tests/test_operator_news_generation.py tests/test_operator_review_reply_bulk.py tests/test_operator_manual_review.py tests/test_operator_inbox.py tests/test_operator_paid_preflight.py tests/test_operator_credit_reservation.py tests/test_operator_paid_actions.py tests/test_operator_paid_executor.py tests/test_operator_map_refresh.py tests/test_operator_audit.py",
    "cd frontend && npm run build",
    "git diff --check"
  ],
  "artifacts_used": [
    "raw/build.txt",
    "raw/test-unit.txt",
    "raw/frontend-build.txt"
  ]
}
